{
  "version": "1.0",
  "creative_concept": "由反问、证据、步骤与行动号召组成的短视频叙事。",
  "narrative_pattern": "question_proof",
  "theme_profile_id": "editorial_clean",
  "design_intent": {
    "density": "balanced",
    "motion_energy": "medium",
    "image_fit": "smart_crop",
    "decoration_intensity": "medium"
  },
  "scene_directives": [
    {"scene_id":"candidate_01","narrative_role":"hook","layout_id":"quote_reversal","layout_variant":"diagonal_statement","headline":{"text_kind":"verbatim","source_caption_ids":["caption_001"]},"overlay_instances":[{"instance_id":"scene_01_headline","component_id":"headline_block","content_ref":"headline","placement":"title_safe","variant":"primary"},{"instance_id":"scene_01_caption","component_id":"standard_caption","content_ref":"headline","placement":"subtitle_safe","variant":"primary"}],"material_bindings":[],"material_slot_directives":[],"animations":[{"target_id":"scene_01_headline","preset":"wipe","direction":"left","duration_ms":420,"delay_ms":0}],"transition":"soft_wipe","sound_events":[{"role":"reversal","priority":"optional","offset_ms":120}]},
    {"scene_id":"candidate_02","narrative_role":"context","layout_id":"speaker_left_info_right","layout_variant":"speaker_focus","headline":{"text_kind":"verbatim","source_caption_ids":["caption_002"]},"overlay_instances":[{"instance_id":"scene_02_headline","component_id":"headline_block","content_ref":"headline","placement":"right_panel","variant":"primary"}],"material_bindings":[],"material_slot_directives":[],"animations":[{"target_id":"scene_02_headline","preset":"slide","direction":"right","duration_ms":360,"delay_ms":40}],"transition":"directional_slide","sound_events":[]},
    {"scene_id":"candidate_03","narrative_role":"proof","layout_id":"number_proof","layout_variant":"metric_focus","headline":{"text_kind":"verbatim","source_caption_ids":["caption_003"]},"overlay_instances":[{"instance_id":"scene_03_number","component_id":"number_proof","content_ref":"headline","placement":"center","variant":"primary"}],"material_bindings":[],"material_slot_directives":[],"animations":[{"target_id":"scene_03_number","preset":"count_up","direction":"up","duration_ms":600,"delay_ms":0}],"transition":"soft_wipe","sound_events":[{"role":"number","priority":"optional","offset_ms":50}]},
    {"scene_id":"candidate_04","narrative_role":"method","layout_id":"steps_stack","layout_variant":"stacked_steps","headline":{"text_kind":"verbatim","source_caption_ids":["caption_004"]},"overlay_instances":[{"instance_id":"scene_04_step","component_id":"step_indicator","content_ref":"headline","placement":"left_panel","variant":"primary"}],"material_bindings":[],"material_slot_directives":[],"animations":[{"target_id":"scene_04_step","preset":"stagger","direction":"up","duration_ms":480,"delay_ms":0}],"transition":"directional_slide","sound_events":[{"role":"method","priority":"optional","offset_ms":80}]},
    {"scene_id":"candidate_05","narrative_role":"cta","layout_id":"cta_offer","layout_variant":"offer_hold","headline":{"text_kind":"verbatim","source_caption_ids":["caption_005"]},"overlay_instances":[{"instance_id":"scene_05_cta","component_id":"cta_hold","content_ref":"headline","placement":"lower_third","variant":"primary"}],"material_bindings":[],"material_slot_directives":[],"animations":[{"target_id":"scene_05_cta","preset":"scale","direction":"in","duration_ms":360,"delay_ms":0}],"transition":"soft_wipe","sound_events":[{"role":"cta","priority":"optional","offset_ms":0}]}
  ],
  "audio_intent": {"bgm_description":"克制、现代、无歌词，确保口播清晰。","energy":"medium","dialogue_priority":true}
}
